{
  "name": "Cobalt",
  "symbol": "Co",
  "atomic_number": 27,
  "atomic_mass_u": 58.933,
  "atomic_mass_uncertainty_u": 0.001,
  "classification": {
    "group": 9,
    "period": 4,
    "block": "d",
    "category": "transition metal",
    "series": "transition metal",
    "natural_occurrence": "primordial"
  },
  "atomic_structure": {
    "electron_configuration": "[Ar] 3d7 4s2",
    "electron_configuration_long": "1s2 2s2 2p6 3s2 3p6 3d7 4s2",
    "electron_shells": [
      2,
      8,
      15,
      2
    ],
    "valence_electrons": 9,
    "oxidation_states": [
      -3,
      -1,
      1,
      2,
      3,
      4,
      5
    ],
    "common_oxidation_states": [
      2,
      3
    ],
    "electronegativity_pauling": 1.88,
    "ionization_energies_kj_mol": [
      760.4
    ],
    "electron_affinity_kj_mol": 63.898,
    "atomic_radius_pm": 152,
    "covalent_radius_pm": 126,
    "van_der_waals_radius_pm": null
  },
  "physical_properties": {
    "phase_at_stp": "solid",
    "melting_point_k": 1768.0,
    "boiling_point_k": 3200.0,
    "density_kg_m3": 8900.0,
    "density_liquid_kg_m3": null,
    "triple_point_k": null,
    "triple_point_kpa": null,
    "critical_point_k": null,
    "critical_point_mpa": null,
    "heat_of_fusion_kj_mol": 16.06,
    "heat_of_vaporization_kj_mol": 377.0,
    "molar_heat_capacity_j_mol_k": 24.81,
    "color": "hard lustrous grey",
    "crystal_structure": "hexagonal close-packed",
    "magnetic_ordering": "ferromagnetic",
    "speed_of_sound_m_s": 4720,
    "thermal_conductivity_w_m_k": 100.0,
    "thermal_expansion_per_k": 1.3e-05,
    "mohs_hardness": 5.0,
    "bulk_modulus_gpa": 180,
    "shear_modulus_gpa": 75,
    "young_modulus_gpa": 209,
    "poisson_ratio": 0.31
  },
  "nuclear_properties": {
    "radioactive": false,
    "half_life": null,
    "decay_mode": null,
    "stable_isotopes": [
      59
    ],
    "isotopes": [
      {
        "mass_number": 59,
        "symbol": "59Co",
        "name": null,
        "neutrons": 32,
        "abundance_percent": 100.0,
        "mass_u": 58.933,
        "half_life": "stable",
        "decay_mode": null,
        "spin": null
      }
    ]
  },
  "abundance": {
    "universe_percent": 0.0003,
    "solar_percent": 0.0003,
    "earth_crust_ppm": 25,
    "ocean_ppm": 2e-05,
    "human_body_percent": 3e-06
  },
  "discovery": {
    "year": 1735,
    "discoverers": [
      "Georg Brandt"
    ],
    "country": "Sweden",
    "named_by": null,
    "name_origin": "German 'kobald' (goblin)"
  },
  "applications": [
    "Cobalt blue pigments",
    "Lithium-ion battery cathodes (LiCoO2)",
    "Superalloys (jet engine turbines)",
    "Magnetic alloys (Alnico magnets)",
    "Gamma radiation source (60Co)",
    "Vitamin B12 (cobalamin)",
    "Catalysts (Fischer-Tropsch process)"
  ],
  "hazards": {
    "ghs_pictograms": [],
    "signal_word": null,
    "nfpa_704": null,
    "hazard_statements": [],
    "autoignition_temp_k": null,
    "flash_point_k": null,
    "explosive_limits_percent": null
  },
  "reactions": []
}