{
  "name": "Americium",
  "symbol": "Am",
  "atomic_number": 95,
  "atomic_mass_u": 243.0,
  "atomic_mass_uncertainty_u": null,
  "classification": {
    "group": null,
    "period": 7,
    "block": "f",
    "category": "actinide",
    "series": "actinide",
    "natural_occurrence": "synthetic"
  },
  "atomic_structure": {
    "electron_configuration": "[Rn] 5f7 7s2",
    "electron_configuration_long": "1s2 2s2 2p6 3s2 3p6 3d10 4s2 4p6 4d10 5s2 5p6 4f14 5d10 6s2 6p6 5f7 7s2",
    "electron_shells": [
      2,
      8,
      18,
      32,
      25,
      8,
      2
    ],
    "valence_electrons": 9,
    "oxidation_states": [
      2,
      3,
      4,
      5,
      6,
      7
    ],
    "common_oxidation_states": [
      3
    ],
    "electronegativity_pauling": 1.13,
    "ionization_energies_kj_mol": [
      578.0
    ],
    "electron_affinity_kj_mol": 9.93,
    "atomic_radius_pm": null,
    "covalent_radius_pm": 180,
    "van_der_waals_radius_pm": null
  },
  "physical_properties": {
    "phase_at_stp": "solid",
    "melting_point_k": 1449.0,
    "boiling_point_k": 2880.0,
    "density_kg_m3": 12000.0,
    "density_liquid_kg_m3": null,
    "triple_point_k": null,
    "triple_point_kpa": null,
    "critical_point_k": null,
    "critical_point_mpa": null,
    "heat_of_fusion_kj_mol": 14.39,
    "heat_of_vaporization_kj_mol": null,
    "molar_heat_capacity_j_mol_k": 62.7,
    "color": "silvery-white",
    "crystal_structure": "hexagonal close-packed",
    "magnetic_ordering": "paramagnetic",
    "speed_of_sound_m_s": null,
    "thermal_conductivity_w_m_k": 10.0,
    "thermal_expansion_per_k": null,
    "mohs_hardness": null,
    "bulk_modulus_gpa": null,
    "shear_modulus_gpa": null,
    "young_modulus_gpa": null,
    "poisson_ratio": null
  },
  "nuclear_properties": {
    "radioactive": true,
    "half_life": "7370 y",
    "decay_mode": "alpha",
    "stable_isotopes": [],
    "isotopes": [
      {
        "mass_number": 243,
        "symbol": "243Am",
        "name": null,
        "neutrons": 148,
        "abundance_percent": null,
        "mass_u": 243.0,
        "half_life": "7370 y",
        "decay_mode": "alpha",
        "spin": null
      }
    ]
  },
  "abundance": {
    "universe_percent": null,
    "solar_percent": null,
    "earth_crust_ppm": null,
    "ocean_ppm": null,
    "human_body_percent": null
  },
  "discovery": {
    "year": 1944,
    "discoverers": [
      "Glenn T. Seaborg",
      "Ralph A. James",
      "Leon O. Morgan",
      "Albert Ghiorso"
    ],
    "country": "United States",
    "named_by": "Glenn T. Seaborg",
    "name_origin": "The Americas"
  },
  "applications": [
    "Smoke detectors (241Am)",
    "Industrial gauges",
    "Neutron sources"
  ],
  "hazards": {
    "ghs_pictograms": [],
    "signal_word": null,
    "nfpa_704": null,
    "hazard_statements": [],
    "autoignition_temp_k": null,
    "flash_point_k": null,
    "explosive_limits_percent": null
  },
  "reactions": []
}