{
  "name": "Argon",
  "symbol": "Ar",
  "atomic_number": 18,
  "atomic_mass_u": 39.948,
  "atomic_mass_uncertainty_u": 0.001,
  "classification": {
    "group": 18,
    "period": 3,
    "block": "p",
    "category": "noble gas",
    "series": "noble gas",
    "natural_occurrence": "primordial"
  },
  "atomic_structure": {
    "electron_configuration": "[Ne] 3s2 3p6",
    "electron_configuration_long": "1s2 2s2 2p6 3s2 3p6",
    "electron_shells": [
      2,
      8,
      8
    ],
    "valence_electrons": 8,
    "oxidation_states": [
      0
    ],
    "common_oxidation_states": [
      0
    ],
    "electronegativity_pauling": null,
    "ionization_energies_kj_mol": [
      1520.6
    ],
    "electron_affinity_kj_mol": -96.0,
    "atomic_radius_pm": 71,
    "covalent_radius_pm": 106,
    "van_der_waals_radius_pm": 188
  },
  "physical_properties": {
    "phase_at_stp": "gas",
    "melting_point_k": 83.81,
    "boiling_point_k": 87.302,
    "density_kg_m3": 1.784,
    "density_liquid_kg_m3": 1395.4,
    "triple_point_k": 83.8058,
    "triple_point_kpa": 68.95,
    "critical_point_k": 150.687,
    "critical_point_mpa": 4.863,
    "heat_of_fusion_kj_mol": 1.18,
    "heat_of_vaporization_kj_mol": 6.43,
    "molar_heat_capacity_j_mol_k": 20.786,
    "color": "colorless",
    "crystal_structure": "face-centered cubic",
    "magnetic_ordering": "diamagnetic",
    "speed_of_sound_m_s": null,
    "thermal_conductivity_w_m_k": 0.01772,
    "thermal_expansion_per_k": null,
    "mohs_hardness": null,
    "bulk_modulus_gpa": null,
    "shear_modulus_gpa": null,
    "young_modulus_gpa": null,
    "poisson_ratio": null
  },
  "nuclear_properties": {
    "radioactive": false,
    "half_life": null,
    "decay_mode": null,
    "stable_isotopes": [
      36,
      38,
      40
    ],
    "isotopes": [
      {
        "mass_number": 36,
        "symbol": "36Ar",
        "name": null,
        "neutrons": 18,
        "abundance_percent": 0.3365,
        "mass_u": 35.967546,
        "half_life": "stable",
        "decay_mode": null,
        "spin": "0+"
      },
      {
        "mass_number": 38,
        "symbol": "38Ar",
        "name": null,
        "neutrons": 20,
        "abundance_percent": 0.0632,
        "mass_u": 37.962732,
        "half_life": "stable",
        "decay_mode": null,
        "spin": "0+"
      },
      {
        "mass_number": 40,
        "symbol": "40Ar",
        "name": null,
        "neutrons": 22,
        "abundance_percent": 99.6003,
        "mass_u": 39.962383,
        "half_life": "stable",
        "decay_mode": null,
        "spin": "0+"
      }
    ]
  },
  "abundance": {
    "universe_percent": 0.02,
    "solar_percent": 0.02,
    "earth_crust_ppm": 3.5,
    "ocean_ppm": 0.45,
    "human_body_percent": null
  },
  "discovery": {
    "year": 1894,
    "discoverers": [
      "Lord Rayleigh",
      "William Ramsay"
    ],
    "country": "England",
    "named_by": "Lord Rayleigh",
    "name_origin": "Greek 'argon' (idle)"
  },
  "applications": [
    "Welding shielding gas",
    "Incandescent light bulb fill gas",
    "Thermal insulation (double-pane windows)",
    "Electronics manufacturing (plasma etching)",
    "Blue argon lasers",
    "Wine preservation"
  ],
  "hazards": {
    "ghs_pictograms": [
      "GHS04"
    ],
    "signal_word": "Warning",
    "nfpa_704": null,
    "hazard_statements": [],
    "autoignition_temp_k": null,
    "flash_point_k": null,
    "explosive_limits_percent": null
  },
  "reactions": []
}