{
  "name": "Astatine",
  "symbol": "At",
  "atomic_number": 85,
  "atomic_mass_u": 210.0,
  "atomic_mass_uncertainty_u": null,
  "classification": {
    "group": 17,
    "period": 6,
    "block": "p",
    "category": "metalloid",
    "series": "halogen",
    "natural_occurrence": "from decay"
  },
  "atomic_structure": {
    "electron_configuration": "[Xe] 4f14 5d10 6s2 6p5",
    "electron_configuration_long": "1s2 2s2 2p6 3s2 3p6 3d10 4s2 4p6 4d10 5s2 5p6 4f14 5d10 6s2 6p5",
    "electron_shells": [
      2,
      8,
      18,
      32,
      18,
      7
    ],
    "valence_electrons": 7,
    "oxidation_states": [
      -1,
      1,
      3,
      5,
      7
    ],
    "common_oxidation_states": [
      -1,
      1
    ],
    "electronegativity_pauling": 2.2,
    "ionization_energies_kj_mol": [
      890.0
    ],
    "electron_affinity_kj_mol": 233.0,
    "atomic_radius_pm": 127,
    "covalent_radius_pm": 150,
    "van_der_waals_radius_pm": 202
  },
  "physical_properties": {
    "phase_at_stp": "solid",
    "melting_point_k": 575.0,
    "boiling_point_k": 610.0,
    "density_kg_m3": 6350.0,
    "density_liquid_kg_m3": null,
    "triple_point_k": null,
    "triple_point_kpa": null,
    "critical_point_k": null,
    "critical_point_mpa": null,
    "heat_of_fusion_kj_mol": 6.0,
    "heat_of_vaporization_kj_mol": 54.39,
    "molar_heat_capacity_j_mol_k": null,
    "color": "metallic",
    "crystal_structure": null,
    "magnetic_ordering": null,
    "speed_of_sound_m_s": null,
    "thermal_conductivity_w_m_k": 1.7,
    "thermal_expansion_per_k": null,
    "mohs_hardness": null,
    "bulk_modulus_gpa": null,
    "shear_modulus_gpa": null,
    "young_modulus_gpa": null,
    "poisson_ratio": null
  },
  "nuclear_properties": {
    "radioactive": true,
    "half_life": "8.1 h",
    "decay_mode": "alpha/beta-plus/EC",
    "stable_isotopes": [],
    "isotopes": [
      {
        "mass_number": 210,
        "symbol": "210At",
        "name": null,
        "neutrons": 125,
        "abundance_percent": null,
        "mass_u": 210.0,
        "half_life": "8.1 h",
        "decay_mode": "alpha/beta-plus/EC",
        "spin": null
      }
    ]
  },
  "abundance": {
    "universe_percent": null,
    "solar_percent": null,
    "earth_crust_ppm": null,
    "ocean_ppm": null,
    "human_body_percent": null
  },
  "discovery": {
    "year": 1940,
    "discoverers": [
      "Dale R. Corson",
      "Kenneth Ross MacKenzie",
      "Emilio Segre"
    ],
    "country": "United States",
    "named_by": null,
    "name_origin": "Greek 'astatos' (unstable)"
  },
  "applications": [
    "Medical research (211At targeted alpha therapy)"
  ],
  "hazards": {
    "ghs_pictograms": [],
    "signal_word": null,
    "nfpa_704": null,
    "hazard_statements": [],
    "autoignition_temp_k": null,
    "flash_point_k": null,
    "explosive_limits_percent": null
  },
  "reactions": []
}