{
  "name": "Vanadium",
  "symbol": "V",
  "atomic_number": 23,
  "atomic_mass_u": 50.942,
  "atomic_mass_uncertainty_u": 0.001,
  "classification": {
    "group": 5,
    "period": 4,
    "block": "d",
    "category": "transition metal",
    "series": "transition metal",
    "natural_occurrence": "primordial"
  },
  "atomic_structure": {
    "electron_configuration": "[Ar] 3d3 4s2",
    "electron_configuration_long": "1s2 2s2 2p6 3s2 3p6 3d3 4s2",
    "electron_shells": [
      2,
      8,
      11,
      2
    ],
    "valence_electrons": 5,
    "oxidation_states": [
      -3,
      -1,
      1,
      2,
      3,
      4,
      5
    ],
    "common_oxidation_states": [
      5
    ],
    "electronegativity_pauling": 1.63,
    "ionization_energies_kj_mol": [
      650.9
    ],
    "electron_affinity_kj_mol": 50.911,
    "atomic_radius_pm": 171,
    "covalent_radius_pm": 153,
    "van_der_waals_radius_pm": null
  },
  "physical_properties": {
    "phase_at_stp": "solid",
    "melting_point_k": 2183.0,
    "boiling_point_k": 3680.0,
    "density_kg_m3": 6110.0,
    "density_liquid_kg_m3": null,
    "triple_point_k": null,
    "triple_point_kpa": null,
    "critical_point_k": null,
    "critical_point_mpa": null,
    "heat_of_fusion_kj_mol": 21.5,
    "heat_of_vaporization_kj_mol": 459.0,
    "molar_heat_capacity_j_mol_k": 24.89,
    "color": "blue-silver-grey",
    "crystal_structure": "body-centered cubic",
    "magnetic_ordering": "paramagnetic",
    "speed_of_sound_m_s": 6000,
    "thermal_conductivity_w_m_k": 30.7,
    "thermal_expansion_per_k": 8.4e-06,
    "mohs_hardness": 6.7,
    "bulk_modulus_gpa": 160,
    "shear_modulus_gpa": 47,
    "young_modulus_gpa": 128,
    "poisson_ratio": 0.37
  },
  "nuclear_properties": {
    "radioactive": false,
    "half_life": null,
    "decay_mode": null,
    "stable_isotopes": [
      51
    ],
    "isotopes": [
      {
        "mass_number": 51,
        "symbol": "51V",
        "name": null,
        "neutrons": 28,
        "abundance_percent": null,
        "mass_u": 50.942,
        "half_life": "stable",
        "decay_mode": null,
        "spin": null
      }
    ]
  },
  "abundance": {
    "universe_percent": 0.0001,
    "solar_percent": 0.0001,
    "earth_crust_ppm": 120,
    "ocean_ppm": 0.0025,
    "human_body_percent": 3e-06
  },
  "discovery": {
    "year": 1801,
    "discoverers": [
      "Andres Manuel del Rio"
    ],
    "country": "Mexico",
    "named_by": "Nils Gabriel Sefstrom",
    "name_origin": "Old Norse 'Vanadis' (Freyja)"
  },
  "applications": [
    "Vanadium steel alloys",
    "Vanadium redox flow batteries",
    "Catalysts (V2O5)",
    "Aerospace alloys"
  ],
  "hazards": {
    "ghs_pictograms": [],
    "signal_word": null,
    "nfpa_704": null,
    "hazard_statements": [],
    "autoignition_temp_k": null,
    "flash_point_k": null,
    "explosive_limits_percent": null
  },
  "reactions": []
}