{
  "name": "Technetium",
  "symbol": "Tc",
  "atomic_number": 43,
  "atomic_mass_u": 98.0,
  "atomic_mass_uncertainty_u": null,
  "classification": {
    "group": 7,
    "period": 5,
    "block": "d",
    "category": "transition metal",
    "series": "transition metal",
    "natural_occurrence": "from decay"
  },
  "atomic_structure": {
    "electron_configuration": "[Kr] 4d5 5s2",
    "electron_configuration_long": "1s2 2s2 2p6 3s2 3p6 3d10 4s2 4p6 4d5 5s2",
    "electron_shells": [
      2,
      8,
      18,
      13,
      2
    ],
    "valence_electrons": 7,
    "oxidation_states": [
      -3,
      -1,
      1,
      2,
      3,
      4,
      5,
      6,
      7
    ],
    "common_oxidation_states": [
      4,
      7
    ],
    "electronegativity_pauling": 1.9,
    "ionization_energies_kj_mol": [
      702.0
    ],
    "electron_affinity_kj_mol": 53.0,
    "atomic_radius_pm": 183,
    "covalent_radius_pm": 147,
    "van_der_waals_radius_pm": null
  },
  "physical_properties": {
    "phase_at_stp": "solid",
    "melting_point_k": 2430.0,
    "boiling_point_k": 4538.0,
    "density_kg_m3": 11500.0,
    "density_liquid_kg_m3": null,
    "triple_point_k": null,
    "triple_point_kpa": null,
    "critical_point_k": null,
    "critical_point_mpa": null,
    "heat_of_fusion_kj_mol": 33.29,
    "heat_of_vaporization_kj_mol": 585.2,
    "molar_heat_capacity_j_mol_k": 24.27,
    "color": "silvery-grey",
    "crystal_structure": "hexagonal close-packed",
    "magnetic_ordering": "paramagnetic",
    "speed_of_sound_m_s": null,
    "thermal_conductivity_w_m_k": 50.6,
    "thermal_expansion_per_k": null,
    "mohs_hardness": null,
    "bulk_modulus_gpa": null,
    "shear_modulus_gpa": null,
    "young_modulus_gpa": null,
    "poisson_ratio": null
  },
  "nuclear_properties": {
    "radioactive": true,
    "half_life": "4.21e6 y",
    "decay_mode": "beta-minus",
    "stable_isotopes": [],
    "isotopes": [
      {
        "mass_number": 98,
        "symbol": "98Tc",
        "name": null,
        "neutrons": 55,
        "abundance_percent": null,
        "mass_u": 98.0,
        "half_life": "4.21e6 y",
        "decay_mode": "beta-minus",
        "spin": null
      }
    ]
  },
  "abundance": {
    "universe_percent": null,
    "solar_percent": null,
    "earth_crust_ppm": null,
    "ocean_ppm": null,
    "human_body_percent": null
  },
  "discovery": {
    "year": 1937,
    "discoverers": [
      "Carlo Perrier",
      "Emilio Segre"
    ],
    "country": "Italy",
    "named_by": "Carlo Perrier",
    "name_origin": "Greek 'technetos' (artificial)"
  },
  "applications": [
    "Medical imaging (99mTc radiopharmaceutical)",
    "Nuclear medicine (most used medical isotope)",
    "Equipment calibration"
  ],
  "hazards": {
    "ghs_pictograms": [],
    "signal_word": null,
    "nfpa_704": null,
    "hazard_statements": [],
    "autoignition_temp_k": null,
    "flash_point_k": null,
    "explosive_limits_percent": null
  },
  "reactions": []
}