{
  "name": "Bismuth",
  "symbol": "Bi",
  "atomic_number": 83,
  "atomic_mass_u": 208.98,
  "atomic_mass_uncertainty_u": 0.01,
  "classification": {
    "group": 15,
    "period": 6,
    "block": "p",
    "category": "post-transition metal",
    "series": "poor metal",
    "natural_occurrence": "primordial"
  },
  "atomic_structure": {
    "electron_configuration": "[Xe] 4f14 5d10 6s2 6p3",
    "electron_configuration_long": "1s2 2s2 2p6 3s2 3p6 3d10 4s2 4p6 4d10 5s2 5p6 4f14 5d10 6s2 6p3",
    "electron_shells": [
      2,
      8,
      18,
      32,
      18,
      5
    ],
    "valence_electrons": 5,
    "oxidation_states": [
      -3,
      1,
      3,
      5
    ],
    "common_oxidation_states": [
      3
    ],
    "electronegativity_pauling": 2.02,
    "ionization_energies_kj_mol": [
      703.0
    ],
    "electron_affinity_kj_mol": 90.924,
    "atomic_radius_pm": 143,
    "covalent_radius_pm": 148,
    "van_der_waals_radius_pm": 207
  },
  "physical_properties": {
    "phase_at_stp": "solid",
    "melting_point_k": 544.7,
    "boiling_point_k": 1837.0,
    "density_kg_m3": 9780.0,
    "density_liquid_kg_m3": null,
    "triple_point_k": null,
    "triple_point_kpa": null,
    "critical_point_k": null,
    "critical_point_mpa": null,
    "heat_of_fusion_kj_mol": 11.3,
    "heat_of_vaporization_kj_mol": 179.0,
    "molar_heat_capacity_j_mol_k": 25.52,
    "color": "lustrous brownish-silver",
    "crystal_structure": "rhombohedral",
    "magnetic_ordering": "diamagnetic",
    "speed_of_sound_m_s": 1790,
    "thermal_conductivity_w_m_k": 7.97,
    "thermal_expansion_per_k": 1.34e-05,
    "mohs_hardness": 2.25,
    "bulk_modulus_gpa": 31,
    "shear_modulus_gpa": 12,
    "young_modulus_gpa": 32,
    "poisson_ratio": 0.33
  },
  "nuclear_properties": {
    "radioactive": false,
    "half_life": null,
    "decay_mode": null,
    "stable_isotopes": [
      209
    ],
    "isotopes": [
      {
        "mass_number": 209,
        "symbol": "209Bi",
        "name": null,
        "neutrons": 126,
        "abundance_percent": 100.0,
        "mass_u": 208.98,
        "half_life": "stable",
        "decay_mode": null,
        "spin": null
      }
    ]
  },
  "abundance": {
    "universe_percent": null,
    "solar_percent": null,
    "earth_crust_ppm": 0.009,
    "ocean_ppm": null,
    "human_body_percent": null
  },
  "discovery": {
    "year": 1753,
    "discoverers": [
      "Claude Francois Geoffroy"
    ],
    "country": "France",
    "named_by": null,
    "name_origin": "German 'Bisemutum'"
  },
  "applications": [
    "Pharmaceuticals (Pepto-Bismol)",
    "Cosmetics",
    "Fire sprinkler triggers (low-melting alloys)",
    "Nuclear medicine",
    "Lead-free shot (hunting)"
  ],
  "hazards": {
    "ghs_pictograms": [],
    "signal_word": null,
    "nfpa_704": null,
    "hazard_statements": [],
    "autoignition_temp_k": null,
    "flash_point_k": null,
    "explosive_limits_percent": null
  },
  "reactions": [
    {
      "id": "Bi-notable-001",
      "name": "Bismuth subsalicylate (Pepto-Bismol pink)",
      "equation": "Bi2O3(s) + 6 HCl(aq) -> 2 BiCl3(aq) + 3 H2O(l)",
      "type": "acid dissolution",
      "category": "notable",
      "delta_h_kj": null,
      "conditions": null,
      "description": "Bismuth is the heaviest non-radioactive element used in medicine. Pepto-Bismol's pink active ingredient.",
      "reversible": false
    }
  ]
}
