{
  "name": "Boron",
  "symbol": "B",
  "atomic_number": 5,
  "atomic_mass_u": 10.81,
  "atomic_mass_uncertainty_u": 0.02,
  "classification": {
    "group": 13,
    "period": 2,
    "block": "p",
    "category": "metalloid",
    "series": "metalloid",
    "natural_occurrence": "primordial"
  },
  "atomic_structure": {
    "electron_configuration": "[He] 2s2 2p1",
    "electron_configuration_long": "1s2 2s2 2p1",
    "electron_shells": [
      2,
      3
    ],
    "valence_electrons": 3,
    "oxidation_states": [
      -5,
      -1,
      1,
      2,
      3
    ],
    "common_oxidation_states": [
      3
    ],
    "electronegativity_pauling": 2.04,
    "ionization_energies_kj_mol": [
      800.6
    ],
    "electron_affinity_kj_mol": 26.989,
    "atomic_radius_pm": 87,
    "covalent_radius_pm": 84,
    "van_der_waals_radius_pm": 192
  },
  "physical_properties": {
    "phase_at_stp": "solid",
    "melting_point_k": 2349.0,
    "boiling_point_k": 4200.0,
    "density_kg_m3": 2340.0,
    "density_liquid_kg_m3": null,
    "triple_point_k": null,
    "triple_point_kpa": null,
    "critical_point_k": null,
    "critical_point_mpa": null,
    "heat_of_fusion_kj_mol": 50.2,
    "heat_of_vaporization_kj_mol": 508.0,
    "molar_heat_capacity_j_mol_k": 11.087,
    "color": "black-brown",
    "crystal_structure": "rhombohedral",
    "magnetic_ordering": "diamagnetic",
    "speed_of_sound_m_s": 16200,
    "thermal_conductivity_w_m_k": 27.4,
    "thermal_expansion_per_k": null,
    "mohs_hardness": 9.3,
    "bulk_modulus_gpa": null,
    "shear_modulus_gpa": null,
    "young_modulus_gpa": null,
    "poisson_ratio": null
  },
  "nuclear_properties": {
    "radioactive": false,
    "half_life": null,
    "decay_mode": null,
    "stable_isotopes": [
      10,
      11
    ],
    "isotopes": [
      {
        "mass_number": 10,
        "symbol": "10B",
        "name": null,
        "neutrons": 5,
        "abundance_percent": 19.9,
        "mass_u": 10.012937,
        "half_life": "stable",
        "decay_mode": null,
        "spin": "3+"
      },
      {
        "mass_number": 11,
        "symbol": "11B",
        "name": null,
        "neutrons": 6,
        "abundance_percent": 80.1,
        "mass_u": 11.0093054,
        "half_life": "stable",
        "decay_mode": null,
        "spin": "3/2-"
      }
    ]
  },
  "abundance": {
    "universe_percent": 1e-07,
    "solar_percent": 1e-07,
    "earth_crust_ppm": 10,
    "ocean_ppm": 4.44,
    "human_body_percent": 7e-05
  },
  "discovery": {
    "year": 1808,
    "discoverers": [
      "Joseph Louis Gay-Lussac",
      "Louis Jacques Thenard",
      "Humphry Davy"
    ],
    "country": "France/England",
    "named_by": null,
    "name_origin": "Arabic 'buraq' (borax)"
  },
  "applications": [
    "Borosilicate glass (Pyrex)",
    "Fiberglass insulation",
    "Neodymium magnets (NdFeB alloys)",
    "Nuclear reactor control rods (10B)",
    "Semiconductors (boron doping)",
    "Detergents (borax)"
  ],
  "hazards": {
    "ghs_pictograms": [],
    "signal_word": null,
    "nfpa_704": null,
    "hazard_statements": [],
    "autoignition_temp_k": null,
    "flash_point_k": null,
    "explosive_limits_percent": null
  },
  "reactions": [
    {
      "id": "B-notable-001",
      "name": "Boron green flame",
      "equation": "4 B(s) + 3 O2(g) -> 2 B2O3(s)",
      "type": "combustion",
      "category": "notable",
      "delta_h_kj": -2546,
      "conditions": "brilliant green flame; boron compounds used in fireworks for green color",
      "description": "Boron burns with a distinctive bright green flame. Boric acid used in firework coloring.",
      "reversible": false
    }
  ]
}
