{
  "name": "Gallium",
  "symbol": "Ga",
  "atomic_number": 31,
  "atomic_mass_u": 69.723,
  "atomic_mass_uncertainty_u": 0.001,
  "classification": {
    "group": 13,
    "period": 4,
    "block": "p",
    "category": "post-transition metal",
    "series": "poor metal",
    "natural_occurrence": "primordial"
  },
  "atomic_structure": {
    "electron_configuration": "[Ar] 3d10 4s2 4p1",
    "electron_configuration_long": "1s2 2s2 2p6 3s2 3p6 3d10 4s2 4p1",
    "electron_shells": [
      2,
      8,
      18,
      3
    ],
    "valence_electrons": 3,
    "oxidation_states": [
      1,
      2,
      3
    ],
    "common_oxidation_states": [
      3
    ],
    "electronegativity_pauling": 1.81,
    "ionization_energies_kj_mol": [
      578.8
    ],
    "electron_affinity_kj_mol": 41.0,
    "atomic_radius_pm": 136,
    "covalent_radius_pm": 122,
    "van_der_waals_radius_pm": 187
  },
  "physical_properties": {
    "phase_at_stp": "solid",
    "melting_point_k": 302.91,
    "boiling_point_k": 2673.0,
    "density_kg_m3": 5910.0,
    "density_liquid_kg_m3": 6095.0,
    "triple_point_k": null,
    "triple_point_kpa": null,
    "critical_point_k": null,
    "critical_point_mpa": null,
    "heat_of_fusion_kj_mol": 5.59,
    "heat_of_vaporization_kj_mol": 256.0,
    "molar_heat_capacity_j_mol_k": 25.86,
    "color": "silvery-blue",
    "crystal_structure": "orthorhombic",
    "magnetic_ordering": "diamagnetic",
    "speed_of_sound_m_s": 2740,
    "thermal_conductivity_w_m_k": 40.6,
    "thermal_expansion_per_k": 1.8e-05,
    "mohs_hardness": 1.5,
    "bulk_modulus_gpa": 56,
    "shear_modulus_gpa": null,
    "young_modulus_gpa": 9.8,
    "poisson_ratio": null
  },
  "nuclear_properties": {
    "radioactive": false,
    "half_life": null,
    "decay_mode": null,
    "stable_isotopes": [
      69,
      71
    ],
    "isotopes": [
      {
        "mass_number": 70,
        "symbol": "70Ga",
        "name": null,
        "neutrons": 39,
        "abundance_percent": null,
        "mass_u": 69.723,
        "half_life": "stable",
        "decay_mode": null,
        "spin": null
      }
    ]
  },
  "abundance": {
    "universe_percent": 1e-06,
    "solar_percent": 1e-06,
    "earth_crust_ppm": 19,
    "ocean_ppm": 3e-05,
    "human_body_percent": null
  },
  "discovery": {
    "year": 1875,
    "discoverers": [
      "Paul Emile Lecoq de Boisbaudran"
    ],
    "country": "France",
    "named_by": "Paul Emile Lecoq de Boisbaudran",
    "name_origin": "Latin 'Gallia' (France)"
  },
  "applications": [
    "Semiconductors (GaAs, GaN)",
    "LEDs",
    "Solar cells (CIGS)",
    "Thermometers",
    "Blu-ray lasers"
  ],
  "hazards": {
    "ghs_pictograms": [
      "GHS05",
      "GHS07"
    ],
    "signal_word": "Danger",
    "nfpa_704": null,
    "hazard_statements": [],
    "autoignition_temp_k": null,
    "flash_point_k": null,
    "explosive_limits_percent": null
  },
  "reactions": [
    {
      "id": "Ga-notable-001",
      "name": "Gallium melts in hand",
      "equation": "Ga(s) -> Ga(l)",
      "type": "phase change",
      "category": "notable",
      "delta_h_kj": 5.59,
      "conditions": "302.91 K; melting point 29.76C; melts from body heat; 'disappearing spoon' trick",
      "description": "Gallium melts just above room temperature (29.76C). 'Disappearing spoon' demonstration.",
      "reversible": false
    }
  ]
}
