{
  "name": "Iodine",
  "symbol": "I",
  "atomic_number": 53,
  "atomic_mass_u": 126.9,
  "atomic_mass_uncertainty_u": 0.01,
  "classification": {
    "group": 17,
    "period": 5,
    "block": "p",
    "category": "reactive nonmetal",
    "series": "halogen",
    "natural_occurrence": "primordial"
  },
  "atomic_structure": {
    "electron_configuration": "[Kr] 4d10 5s2 5p5",
    "electron_configuration_long": "1s2 2s2 2p6 3s2 3p6 3d10 4s2 4p6 4d10 5s2 5p5",
    "electron_shells": [
      2,
      8,
      18,
      18,
      7
    ],
    "valence_electrons": 7,
    "oxidation_states": [
      -1,
      1,
      3,
      5,
      7
    ],
    "common_oxidation_states": [
      -1,
      1,
      5,
      7
    ],
    "electronegativity_pauling": 2.66,
    "ionization_energies_kj_mol": [
      1008.4
    ],
    "electron_affinity_kj_mol": 295.153,
    "atomic_radius_pm": 115,
    "covalent_radius_pm": 139,
    "van_der_waals_radius_pm": 198
  },
  "physical_properties": {
    "phase_at_stp": "solid",
    "melting_point_k": 386.85,
    "boiling_point_k": 457.4,
    "density_kg_m3": 4933.0,
    "density_liquid_kg_m3": null,
    "triple_point_k": null,
    "triple_point_kpa": null,
    "critical_point_k": null,
    "critical_point_mpa": null,
    "heat_of_fusion_kj_mol": 15.52,
    "heat_of_vaporization_kj_mol": 41.57,
    "molar_heat_capacity_j_mol_k": 54.44,
    "color": "lustrous purple-black",
    "crystal_structure": "orthorhombic",
    "magnetic_ordering": "diamagnetic",
    "speed_of_sound_m_s": null,
    "thermal_conductivity_w_m_k": 0.449,
    "thermal_expansion_per_k": null,
    "mohs_hardness": null,
    "bulk_modulus_gpa": null,
    "shear_modulus_gpa": null,
    "young_modulus_gpa": null,
    "poisson_ratio": null
  },
  "nuclear_properties": {
    "radioactive": false,
    "half_life": null,
    "decay_mode": null,
    "stable_isotopes": [
      127
    ],
    "isotopes": [
      {
        "mass_number": 127,
        "symbol": "127I",
        "name": null,
        "neutrons": 74,
        "abundance_percent": 100.0,
        "mass_u": 126.9,
        "half_life": "stable",
        "decay_mode": null,
        "spin": null
      }
    ]
  },
  "abundance": {
    "universe_percent": null,
    "solar_percent": null,
    "earth_crust_ppm": 0.45,
    "ocean_ppm": null,
    "human_body_percent": null
  },
  "discovery": {
    "year": 1811,
    "discoverers": [
      "Bernard Courtois"
    ],
    "country": "France",
    "named_by": "Joseph Louis Gay-Lussac",
    "name_origin": "Greek 'iodes' (violet)"
  },
  "applications": [
    "Iodized salt (thyroid health)",
    "Medical disinfectant",
    "Contrast media (X-ray/CT)",
    "Pharmaceuticals",
    "LCD polarizing filters"
  ],
  "hazards": {
    "ghs_pictograms": [
      "GHS07",
      "GHS05",
      "GHS09"
    ],
    "signal_word": "Warning",
    "nfpa_704": null,
    "hazard_statements": [],
    "autoignition_temp_k": null,
    "flash_point_k": null,
    "explosive_limits_percent": null
  },
  "reactions": [
    {
      "id": "I-laboratory-001",
      "name": "Iodometric titration (thiosulfate)",
      "equation": "I2(aq) + 2 Na2S2O3(aq) -> 2 NaI(aq) + Na2S4O6(aq)",
      "type": "redox titration",
      "category": "laboratory",
      "delta_h_kj": null,
      "conditions": "starch indicator turns blue-black with I2",
      "description": "Iodometric back-titration. Starch indicator; blue to colorless at endpoint.",
      "reversible": false
    },
    {
      "id": "Pb-laboratory-001",
      "name": "Lead(II) iodide precipitation",
      "equation": "Pb(NO3)2(aq) + 2 KI(aq) -> PbI2(s) + 2 KNO3(aq)",
      "type": "precipitation",
      "category": "laboratory",
      "delta_h_kj": null,
      "conditions": "bright yellow precipitate; 'golden rain' demo when hot solution cooled",
      "description": "Golden rain experiment. Bright yellow PbI2 crystallizes from hot solution on cooling.",
      "reversible": false
    },
    {
      "id": "Mn-notable-001",
      "name": "Briggs-Rauscher oscillating reaction",
      "equation": "IO3-(aq) + 2 H2O2(aq) + CH2(COOH)2(aq) + H+(aq) -> ICH(COOH)2(aq) + 2 O2(g) + 3 H2O(l)",
      "type": "oscillating",
      "category": "notable",
      "delta_h_kj": null,
      "conditions": "MnSO4; oscillates amber -> blue -> colorless for ~10 cycles",
      "description": "Chemical oscillator. Color cycles amber -> blue -> colorless repeatedly. Non-equilibrium thermodynamics.",
      "reversible": false
    },
    {
      "id": "N-notable-001",
      "name": "Nitrogen triiodide detonation",
      "equation": "2 NI3(s) -> N2(g) + 3 I2(g)",
      "type": "decomposition",
      "category": "notable",
      "delta_h_kj": -290,
      "conditions": "contact-sensitive when dry; detonates from slightest touch; purple I2 cloud",
      "description": "Extremely sensitive contact explosive. Detonates when dry from a feather touch. Purple iodine cloud produced.",
      "reversible": false
    }
  ]
}
