{
  "name": "Nihonium",
  "symbol": "Nh",
  "atomic_number": 113,
  "atomic_mass_u": 286.0,
  "atomic_mass_uncertainty_u": null,
  "classification": {
    "group": 13,
    "period": 7,
    "block": "p",
    "category": "unknown",
    "series": "unknown",
    "natural_occurrence": "synthetic"
  },
  "atomic_structure": {
    "electron_configuration": "[Rn] 5f14 6d10 7s2 7p1",
    "electron_configuration_long": "1s2 2s2 2p6 3s2 3p6 3d10 4s2 4p6 4d10 5s2 5p6 4f14 5d10 6s2 6p6 5f14 6d10 7s2 7p1",
    "electron_shells": [
      2,
      8,
      18,
      32,
      32,
      18,
      3
    ],
    "valence_electrons": 3,
    "oxidation_states": [
      1
    ],
    "common_oxidation_states": [
      1
    ],
    "electronegativity_pauling": null,
    "ionization_energies_kj_mol": [
      707.0
    ],
    "electron_affinity_kj_mol": null,
    "atomic_radius_pm": null,
    "covalent_radius_pm": null,
    "van_der_waals_radius_pm": null
  },
  "physical_properties": {
    "phase_at_stp": "unknown",
    "melting_point_k": null,
    "boiling_point_k": null,
    "density_kg_m3": null,
    "density_liquid_kg_m3": null,
    "triple_point_k": null,
    "triple_point_kpa": null,
    "critical_point_k": null,
    "critical_point_mpa": null,
    "heat_of_fusion_kj_mol": null,
    "heat_of_vaporization_kj_mol": null,
    "molar_heat_capacity_j_mol_k": null,
    "color": null,
    "crystal_structure": null,
    "magnetic_ordering": null,
    "speed_of_sound_m_s": null,
    "thermal_conductivity_w_m_k": null,
    "thermal_expansion_per_k": null,
    "mohs_hardness": null,
    "bulk_modulus_gpa": null,
    "shear_modulus_gpa": null,
    "young_modulus_gpa": null,
    "poisson_ratio": null
  },
  "nuclear_properties": {
    "radioactive": true,
    "half_life": "2 s",
    "decay_mode": "alpha",
    "stable_isotopes": [],
    "isotopes": [
      {
        "mass_number": 286,
        "symbol": "286Nh",
        "name": null,
        "neutrons": 173,
        "abundance_percent": null,
        "mass_u": 286.0,
        "half_life": "2 s",
        "decay_mode": "alpha",
        "spin": null
      }
    ]
  },
  "abundance": {
    "universe_percent": null,
    "solar_percent": null,
    "earth_crust_ppm": null,
    "ocean_ppm": null,
    "human_body_percent": null
  },
  "discovery": {
    "year": 2003,
    "discoverers": [
      "Kosuke Morita"
    ],
    "country": "Japan",
    "named_by": "IUPAC",
    "name_origin": "Nihon (Japan)"
  },
  "applications": [
    "Nuclear research"
  ],
  "hazards": {
    "ghs_pictograms": [],
    "signal_word": null,
    "nfpa_704": null,
    "hazard_statements": [],
    "autoignition_temp_k": null,
    "flash_point_k": null,
    "explosive_limits_percent": null
  },
  "reactions": []
}