{
  "name": "Platinum",
  "symbol": "Pt",
  "atomic_number": 78,
  "atomic_mass_u": 195.08,
  "atomic_mass_uncertainty_u": 0.01,
  "classification": {
    "group": 10,
    "period": 6,
    "block": "d",
    "category": "transition metal",
    "series": "transition metal",
    "natural_occurrence": "primordial"
  },
  "atomic_structure": {
    "electron_configuration": "[Xe] 4f14 5d9 6s1",
    "electron_configuration_long": "1s2 2s2 2p6 3s2 3p6 3d10 4s2 4p6 4d10 5s2 5p6 4f14 5d9 6s1",
    "electron_shells": [
      2,
      8,
      18,
      32,
      17,
      1
    ],
    "valence_electrons": 10,
    "oxidation_states": [
      -2,
      1,
      2,
      3,
      4,
      5,
      6
    ],
    "common_oxidation_states": [
      2,
      4
    ],
    "electronegativity_pauling": 2.28,
    "ionization_energies_kj_mol": [
      870.0
    ],
    "electron_affinity_kj_mol": 205.041,
    "atomic_radius_pm": 177,
    "covalent_radius_pm": 136,
    "van_der_waals_radius_pm": 175
  },
  "physical_properties": {
    "phase_at_stp": "solid",
    "melting_point_k": 2041.4,
    "boiling_point_k": 4098.0,
    "density_kg_m3": 21450.0,
    "density_liquid_kg_m3": null,
    "triple_point_k": null,
    "triple_point_kpa": null,
    "critical_point_k": null,
    "critical_point_mpa": null,
    "heat_of_fusion_kj_mol": 22.17,
    "heat_of_vaporization_kj_mol": 510.0,
    "molar_heat_capacity_j_mol_k": 25.86,
    "color": "silvery-white",
    "crystal_structure": "face-centered cubic",
    "magnetic_ordering": "paramagnetic",
    "speed_of_sound_m_s": 2680,
    "thermal_conductivity_w_m_k": 71.6,
    "thermal_expansion_per_k": 8.8e-06,
    "mohs_hardness": 3.5,
    "bulk_modulus_gpa": 230,
    "shear_modulus_gpa": 61,
    "young_modulus_gpa": 168,
    "poisson_ratio": 0.38
  },
  "nuclear_properties": {
    "radioactive": false,
    "half_life": null,
    "decay_mode": null,
    "stable_isotopes": [
      190,
      192,
      194,
      195,
      196,
      198
    ],
    "isotopes": [
      {
        "mass_number": 195,
        "symbol": "195Pt",
        "name": null,
        "neutrons": 117,
        "abundance_percent": null,
        "mass_u": 195.08,
        "half_life": "stable",
        "decay_mode": null,
        "spin": null
      }
    ]
  },
  "abundance": {
    "universe_percent": null,
    "solar_percent": null,
    "earth_crust_ppm": 0.005,
    "ocean_ppm": null,
    "human_body_percent": null
  },
  "discovery": {
    "year": 1735,
    "discoverers": [
      "Antonio de Ulloa"
    ],
    "country": "South America",
    "named_by": null,
    "name_origin": "Spanish 'platina' (little silver)"
  },
  "applications": [
    "Catalytic converters (automotive)",
    "Jewelry",
    "Chemotherapy (cisplatin)",
    "Hard disk coatings",
    "Fuel cells (PEMFC catalyst)",
    "Thermocouples (Pt/Rh)",
    "Laboratory crucibles"
  ],
  "hazards": {
    "ghs_pictograms": [],
    "signal_word": null,
    "nfpa_704": null,
    "hazard_statements": [],
    "autoignition_temp_k": null,
    "flash_point_k": null,
    "explosive_limits_percent": null
  },
  "reactions": [
    {
      "id": "Pt-notable-001",
      "name": "Platinum dissolution in aqua regia",
      "equation": "3 Pt(s) + 4 HNO3(aq) + 12 HCl(aq) -> 3 H2PtCl4(aq) + 4 NO(g) + 8 H2O(l)",
      "type": "dissolution",
      "category": "notable",
      "delta_h_kj": null,
      "conditions": "aqua regia ('royal water') named for dissolving noble metals",
      "description": "Aqua regia dissolves platinum. Named 'royal water' by alchemists. Only method for dissolving Pt.",
      "reversible": false
    },
    {
      "id": "Xe-notable-001",
      "name": "Xenon hexafluoroplatinate (first noble gas compound)",
      "equation": "Xe(g) + PtF6(g) -> [XePtF6](s)",
      "type": "synthesis",
      "category": "notable",
      "delta_h_kj": null,
      "conditions": "Neil Bartlett, 1962; orange-yellow solid",
      "description": "First noble gas compound. Neil Bartlett (1962) shattered the 'noble gases are inert' dogma.",
      "reversible": false
    }
  ]
}
