{
  "name": "Barium",
  "symbol": "Ba",
  "atomic_number": 56,
  "atomic_mass_u": 137.33,
  "atomic_mass_uncertainty_u": 0.01,
  "classification": {
    "group": 2,
    "period": 6,
    "block": "s",
    "category": "alkaline earth metal",
    "series": "alkaline earth metal",
    "natural_occurrence": "primordial"
  },
  "atomic_structure": {
    "electron_configuration": "[Xe] 6s2",
    "electron_configuration_long": "1s2 2s2 2p6 3s2 3p6 3d10 4s2 4p6 4d10 5s2 5p6 6s2",
    "electron_shells": [
      2,
      8,
      18,
      18,
      8,
      2
    ],
    "valence_electrons": 2,
    "oxidation_states": [
      1,
      2
    ],
    "common_oxidation_states": [
      2
    ],
    "electronegativity_pauling": 0.89,
    "ionization_energies_kj_mol": [
      502.9
    ],
    "electron_affinity_kj_mol": 13.954,
    "atomic_radius_pm": 253,
    "covalent_radius_pm": 215,
    "van_der_waals_radius_pm": 268
  },
  "physical_properties": {
    "phase_at_stp": "solid",
    "melting_point_k": 1000.0,
    "boiling_point_k": 2118.0,
    "density_kg_m3": 3510.0,
    "density_liquid_kg_m3": null,
    "triple_point_k": null,
    "triple_point_kpa": null,
    "critical_point_k": null,
    "critical_point_mpa": null,
    "heat_of_fusion_kj_mol": 7.12,
    "heat_of_vaporization_kj_mol": 142.0,
    "molar_heat_capacity_j_mol_k": 28.07,
    "color": "silvery-grey",
    "crystal_structure": "body-centered cubic",
    "magnetic_ordering": "paramagnetic",
    "speed_of_sound_m_s": 1620,
    "thermal_conductivity_w_m_k": 18.4,
    "thermal_expansion_per_k": 2.06e-05,
    "mohs_hardness": null,
    "bulk_modulus_gpa": null,
    "shear_modulus_gpa": null,
    "young_modulus_gpa": null,
    "poisson_ratio": null
  },
  "nuclear_properties": {
    "radioactive": false,
    "half_life": null,
    "decay_mode": null,
    "stable_isotopes": [
      130,
      132,
      134,
      135,
      136,
      137,
      138
    ],
    "isotopes": [
      {
        "mass_number": 137,
        "symbol": "137Ba",
        "name": null,
        "neutrons": 81,
        "abundance_percent": null,
        "mass_u": 137.33,
        "half_life": "stable",
        "decay_mode": null,
        "spin": null
      }
    ]
  },
  "abundance": {
    "universe_percent": null,
    "solar_percent": null,
    "earth_crust_ppm": 425,
    "ocean_ppm": null,
    "human_body_percent": null
  },
  "discovery": {
    "year": 1808,
    "discoverers": [
      "Humphry Davy"
    ],
    "country": "England",
    "named_by": "Humphry Davy",
    "name_origin": "Greek 'barys' (heavy)"
  },
  "applications": [
    "Barium sulfate (X-ray contrast, drilling mud)",
    "Spark plugs",
    "Vacuum tubes (getter)",
    "Fireworks (green)",
    "Glass (optical)"
  ],
  "hazards": {
    "ghs_pictograms": [],
    "signal_word": null,
    "nfpa_704": null,
    "hazard_statements": [],
    "autoignition_temp_k": null,
    "flash_point_k": null,
    "explosive_limits_percent": null
  },
  "reactions": [
    {
      "id": "Ba-laboratory-001",
      "name": "Barium sulfate precipitation (sulfate test)",
      "equation": "BaCl2(aq) + Na2SO4(aq) -> BaSO4(s) + 2 NaCl(aq)",
      "type": "precipitation",
      "category": "laboratory",
      "delta_h_kj": null,
      "conditions": "add BaCl2 in dilute HCl to acidified sample",
      "description": "Confirmatory test for sulfate ions. White precipitate insoluble in dilute HCl. Ksp = 1.1e-10.",
      "reversible": false
    },
    {
      "id": "Ba-laboratory-002",
      "name": "Flame test (barium)",
      "equation": "Ba(s) -> Ba*(g) -> Ba(g) + hv (524 nm)",
      "type": "emission",
      "category": "laboratory",
      "delta_h_kj": null,
      "conditions": "nichrome wire; Bunsen burner",
      "description": "Apple green flame for barium. Used in fireworks for green color.",
      "reversible": false
    },
    {
      "id": "Pu-notable-001",
      "name": "Plutonium-239 fission",
      "equation": "Pu-239 + n -> Ba-146 + Sr-91 + 3 n",
      "type": "nuclear fission",
      "category": "notable",
      "delta_h_kj": null,
      "conditions": "thermal neutron capture; ~210 MeV per fission; bred from U-238 in reactors",
      "description": "Plutonium fission. Pu-239 bred from U-238 by neutron capture. Used in breeder reactors and weapons.",
      "reversible": false
    },
    {
      "id": "U-notable-001",
      "name": "Uranium-235 nuclear fission",
      "equation": "U-235 + n -> Ba-141 + Kr-92 + 3 n",
      "type": "nuclear fission",
      "category": "notable",
      "delta_h_kj": null,
      "conditions": "thermal neutron capture; ~200 MeV per fission; chain reaction if k >= 1",
      "description": "Nuclear fission of U-235. ~200 MeV per event. Powers nuclear reactors and weapons. Discovered 1938 by Hahn & Strassmann.",
      "reversible": false
    }
  ]
}
