{
  "name": "Silicon",
  "symbol": "Si",
  "atomic_number": 14,
  "atomic_mass_u": 28.085,
  "atomic_mass_uncertainty_u": 0.001,
  "classification": {
    "group": 14,
    "period": 3,
    "block": "p",
    "category": "metalloid",
    "series": "metalloid",
    "natural_occurrence": "primordial"
  },
  "atomic_structure": {
    "electron_configuration": "[Ne] 3s2 3p2",
    "electron_configuration_long": "1s2 2s2 2p6 3s2 3p2",
    "electron_shells": [
      2,
      8,
      4
    ],
    "valence_electrons": 4,
    "oxidation_states": [
      -4,
      -3,
      -2,
      -1,
      1,
      2,
      3,
      4
    ],
    "common_oxidation_states": [
      -4,
      4
    ],
    "electronegativity_pauling": 1.9,
    "ionization_energies_kj_mol": [
      786.5
    ],
    "electron_affinity_kj_mol": 134.068,
    "atomic_radius_pm": 111,
    "covalent_radius_pm": 111,
    "van_der_waals_radius_pm": 210
  },
  "physical_properties": {
    "phase_at_stp": "solid",
    "melting_point_k": 1687.0,
    "boiling_point_k": 3538.0,
    "density_kg_m3": 2330.0,
    "density_liquid_kg_m3": null,
    "triple_point_k": null,
    "triple_point_kpa": null,
    "critical_point_k": null,
    "critical_point_mpa": null,
    "heat_of_fusion_kj_mol": 50.21,
    "heat_of_vaporization_kj_mol": 359.0,
    "molar_heat_capacity_j_mol_k": 19.789,
    "color": "crystalline grey",
    "crystal_structure": "diamond cubic",
    "magnetic_ordering": "diamagnetic",
    "speed_of_sound_m_s": 8433,
    "thermal_conductivity_w_m_k": 149.0,
    "thermal_expansion_per_k": 2.6e-06,
    "mohs_hardness": 6.5,
    "bulk_modulus_gpa": 100,
    "shear_modulus_gpa": null,
    "young_modulus_gpa": 47,
    "poisson_ratio": null
  },
  "nuclear_properties": {
    "radioactive": false,
    "half_life": null,
    "decay_mode": null,
    "stable_isotopes": [
      28,
      29,
      30
    ],
    "isotopes": [
      {
        "mass_number": 28,
        "symbol": "28Si",
        "name": null,
        "neutrons": 14,
        "abundance_percent": 92.23,
        "mass_u": 27.976927,
        "half_life": "stable",
        "decay_mode": null,
        "spin": "0+"
      },
      {
        "mass_number": 29,
        "symbol": "29Si",
        "name": null,
        "neutrons": 15,
        "abundance_percent": 4.68,
        "mass_u": 28.976495,
        "half_life": "stable",
        "decay_mode": null,
        "spin": "1/2+"
      },
      {
        "mass_number": 30,
        "symbol": "30Si",
        "name": null,
        "neutrons": 16,
        "abundance_percent": 3.09,
        "mass_u": 29.97377,
        "half_life": "stable",
        "decay_mode": null,
        "spin": "0+"
      }
    ]
  },
  "abundance": {
    "universe_percent": 0.07,
    "solar_percent": 0.07,
    "earth_crust_ppm": 282000,
    "ocean_ppm": 2.2,
    "human_body_percent": 0.026
  },
  "discovery": {
    "year": 1824,
    "discoverers": [
      "Jons Jacob Berzelius"
    ],
    "country": "Sweden",
    "named_by": "Thomas Thomson",
    "name_origin": "Latin 'silex' (flint)"
  },
  "applications": [
    "Semiconductor chips (silicon wafers)",
    "Solar cells (photovoltaic)",
    "Silicone polymers (sealants, lubricants)",
    "Glass production (SiO2)",
    "Concrete and cement",
    "Optical fibers",
    "Ceramics"
  ],
  "hazards": {
    "ghs_pictograms": [],
    "signal_word": null,
    "nfpa_704": null,
    "hazard_statements": [],
    "autoignition_temp_k": null,
    "flash_point_k": null,
    "explosive_limits_percent": null
  },
  "reactions": [
    {
      "id": "Si-environmental-001",
      "name": "Silicate weathering (CO2 sink)",
      "equation": "CaSiO3(s) + 2 CO2(g) + 3 H2O(l) -> Ca2+(aq) + 2 HCO3-(aq) + H4SiO4(aq)",
      "type": "weathering",
      "category": "environmental",
      "delta_h_kj": null,
      "conditions": "geological timescale; thermostat of Earth's climate",
      "description": "Silicate weathering is the primary geological CO2 sink. Urey reaction controls climate over millions of years.",
      "reversible": false
    },
    {
      "id": "Ca-industrial-002",
      "name": "Portland cement clinker (belite formation)",
      "equation": "2 CaO(s) + SiO2(s) -> Ca2SiO4(s)",
      "type": "synthesis",
      "category": "industrial",
      "delta_h_kj": -127,
      "conditions": "1723 K; rotary kiln; belite (C2S) phase",
      "description": "Calcium silicate (belite) formation in cement kiln. Key hydraulic phase.",
      "reversible": false
    },
    {
      "id": "Fe-industrial-004",
      "name": "Slag formation in steelmaking",
      "equation": "CaO(s) + SiO2(s) -> CaSiO3(l)",
      "type": "fusion",
      "category": "industrial",
      "delta_h_kj": -89,
      "conditions": "1873 K; limestone flux in blast furnace",
      "description": "CaO flux combines with silica impurities to form slag.",
      "reversible": false
    },
    {
      "id": "Mg-industrial-001",
      "name": "Pidgeon process (magnesium production)",
      "equation": "2 MgO(s) + Si(s) -> 2 Mg(g) + SiO2(s)",
      "type": "reduction",
      "category": "industrial",
      "delta_h_kj": null,
      "conditions": "1473 K; 0.01 atm; vacuum retort; Mg vapor condensed",
      "description": "Pidgeon process: silicothermic reduction of MgO. Dominant in China.",
      "reversible": false
    },
    {
      "id": "P-industrial-001",
      "name": "Phosphorus production (electric arc furnace)",
      "equation": "2 Ca3(PO4)2(s) + 6 SiO2(s) + 10 C(s) -> P4(g) + 6 CaSiO3(l) + 10 CO(g)",
      "type": "reduction",
      "category": "industrial",
      "delta_h_kj": null,
      "conditions": "1773 K; electric arc furnace; P4 vapor condensed under water",
      "description": "White phosphorus production from phosphate rock via electric arc furnace.",
      "reversible": false
    },
    {
      "id": "Si-industrial-001",
      "name": "Soda-lime glass production",
      "equation": "Na2CO3(s) + SiO2(s) -> Na2SiO3(l) + CO2(g)",
      "type": "fusion",
      "category": "industrial",
      "delta_h_kj": null,
      "conditions": "1773 K; glass furnace",
      "description": "Sodium carbonate lowers melting point of silica in glass manufacture.",
      "reversible": false
    },
    {
      "id": "Si-industrial-002",
      "name": "Silicon production (carbothermic reduction)",
      "equation": "SiO2(s) + 2 C(s) -> Si(l) + 2 CO(g)",
      "type": "reduction",
      "category": "industrial",
      "delta_h_kj": 689,
      "conditions": "2173 K; electric arc furnace",
      "description": "Metallurgical-grade silicon production. Purified further for semiconductor use.",
      "reversible": false
    }
  ]
}
